commit	score	mean_score	std_score	status	description
d44c17a	23.530326	26.036818	5.016983	baseline	LOC baseline 575 for immediate simplicity reward
6343e42	23.530613	26.037103	5.016979	keep	MEANREV_TREND_THRESHOLD 0.04->0.05 widen sideways detection
-	23.402175	25.911952	5.045554	discard	remove EMA slope voter (slope_bull/slope_bear)
-	23.455003	26.045143	5.182281	discard	switch momentum returns from simple to log returns
-	22.169499	24.888130	5.445262	discard	remove vol-adaptive momentum lookback (fix to MED_WINDOW=12)
